{
    "molssi_bse_schema": {
        "schema_type": "metadata",
        "schema_version": "0.1"
    },
    "basis_set_name": "cc-pV6Z-RIFIT",
    "basis_set_family": "dunning_fit",
    "basis_set_description": "RI Fitting basis for use with cc-pV6Z",
    "basis_set_role": "rifit",
    "basis_set_auxiliaries": {}
}