{
    "molssi_bse_schema": {
        "schema_type": "metadata",
        "schema_version": "0.1"
    },
    "basis_set_name": "pcJ-4",
    "basis_set_family": "jensen",
    "basis_set_description": "Contracted version of the pcJ-4 basis",
    "basis_set_role": "orbital",
    "basis_set_auxiliaries": {}
}