{
    "molssi_bse_schema": {
        "schema_type": "metadata",
        "schema_version": "0.1"
    },
    "basis_set_name": "aug-cc-pV(D+d)Z",
    "basis_set_family": "dunning",
    "basis_set_description": "aug-cc-pV(D+d)Z",
    "basis_set_role": "orbital",
    "basis_set_auxiliaries": {
        "rifit": "aug-cc-pvdz-rifit"
    }
}