{
    "molssi_bse_schema": {
        "schema_type": "metadata",
        "schema_version": "0.1"
    },
    "basis_set_name": "jorge-ATZP",
    "basis_set_family": "jorge",
    "basis_set_description": "ATZP: Augmented triple zeta valence quality plus polarization",
    "basis_set_role": "orbital",
    "basis_set_auxiliaries": {}
}
