{
    "molssi_bse_schema": {
        "schema_type": "metadata",
        "schema_version": "0.1"
    },
    "basis_set_name": "IGLO-II",
    "basis_set_family": "iglo",
    "basis_set_description": "VDZP Valence Double Zeta + Polarization on All Atoms",
    "basis_set_role": "orbital",
    "basis_set_auxiliaries": {}
}