{
    "molssi_bse_schema": {
        "schema_type": "metadata",
        "schema_version": "0.1"
    },
    "basis_set_name": "jun-cc-pV(T+d)Z",
    "basis_set_family": "truhlar",
    "basis_set_description": "jun-cc-pV(T+d)Z basis of Papajak/Truhlar",
    "basis_set_role": "orbital",
    "basis_set_auxiliaries": {}
}