{
    "molssi_bse_schema": {
        "schema_type": "metadata",
        "schema_version": "0.1"
    },
    "basis_set_name": "def2-ECP",
    "basis_set_family": "ahlrichs",
    "basis_set_description": "ECP for use with Ahlrichs def2 basis sets",
    "basis_set_role": "orbital",
    "basis_set_auxiliaries": {}
}