{
    "molssi_bse_schema": {
        "schema_type": "metadata",
        "schema_version": "0.1"
    },
    "basis_set_name": "STO-2G",
    "basis_set_family": "sto",
    "basis_set_description": "STO-2G Minimal Basis (2 functions/AO)",
    "basis_set_role": "orbital",
    "basis_set_auxiliaries": {}
}